[
  {
    "feed_id": "abc123",
    "title": "测试标题",
    "author": "测试作者",
    "likedCount": 500,
    "collectedCount": 200,
    "commentCount": 30,
    "desc": "测试摘要内容",
    "top_comments": ["评论1"],
    "source_link": "https://example.com/abc123"
  },
  {
    "feed_id": "def456",
    "title": "第二条",
    "author": "作者B",
    "likedCount": 0,
    "collectedCount": 0,
    "commentCount": 0,
    "desc": "",
    "top_comments": [],
    "source_link": ""
  }
]
